title,description,date,source,url,price,address,description_clean
Barrierefreiheit,Wie barrierefrei ist diese Webseite?Erklärung zur BarrierefreiheitHaben Sie Anmerkungen oder Fragen zur Barrierefreiheit dieser Webseite?Kontakt zu...,Upcoming,www.berlin.de,https://www.berlin.de/en/events/concerts/,See Official Site,"Berlin, Germany",wie barrierefrei ist diese webseite?erklärung zur barrierefreiheithaben sie anmerkungen oder fragen zur barrierefreiheit dieser webseite?kontakt zu...
Wie barrierefrei ist diese Webseite?,"Öffnen: SucheSucheSucheSchließen: SucheWo soll gesucht werden?Kultur, Tourismus und StadtlebenKomplette Webseite von Berlin.deSuchbegriffSuchen",Upcoming,www.berlin.de,https://www.berlin.de/en/events/concerts/,See Official Site,"Berlin, Germany","öffnen: suchesuchesucheschließen: suchewo soll gesucht werden?kultur, tourismus und stadtlebenkomplette webseite von berlin.desuchbegriffsuchen"
Haben Sie Anmerkungen oder Fragen zur Barrierefreiheit dieser Webseite?,"Öffnen: SucheSucheSucheSchließen: SucheWo soll gesucht werden?Kultur, Tourismus und StadtlebenKomplette Webseite von Berlin.deSuchbegriffSuchen",Upcoming,www.berlin.de,https://www.berlin.de/en/events/concerts/,See Official Site,"Berlin, Germany","öffnen: suchesuchesucheschließen: suchewo soll gesucht werden?kultur, tourismus und stadtlebenkomplette webseite von berlin.desuchbegriffsuchen"
Wo gibt es zusätzliche Informationen zur Barrierefreiheit im Land Berlin?,"Öffnen: SucheSucheSucheSchließen: SucheWo soll gesucht werden?Kultur, Tourismus und StadtlebenKomplette Webseite von Berlin.deSuchbegriffSuchen",Upcoming,www.berlin.de,https://www.berlin.de/en/events/concerts/,See Official Site,"Berlin, Germany","öffnen: suchesuchesucheschließen: suchewo soll gesucht werden?kultur, tourismus und stadtlebenkomplette webseite von berlin.desuchbegriffsuchen"
Sprache der Webseite ändern,Die Seite wurde nicht gefunden.FehlerbeschreibungDie Rubrik existiert nicht.Finden Sie die gewünschten InformationenSuche auf Berlin.deSuchenKontak...,Upcoming,www.berlin.de,https://www.berlin.de/en/events/concerts/,See Official Site,"Berlin, Germany",die seite wurde nicht gefunden.fehlerbeschreibungdie rubrik existiert nicht.finden sie die gewünschten informationensuche auf berlin.desuchenkontak...
Weitere Links,Die Seite wurde nicht gefunden.FehlerbeschreibungDie Rubrik existiert nicht.Finden Sie die gewünschten InformationenSuche auf Berlin.deSuchenKontak...,Upcoming,www.berlin.de,https://www.berlin.de/en/events/concerts/,See Official Site,"Berlin, Germany",die seite wurde nicht gefunden.fehlerbeschreibungdie rubrik existiert nicht.finden sie die gewünschten informationensuche auf berlin.desuchenkontak...
Weitere Informationen zu Berlin.de,Experience 'Weitere Informationen zu Berlin.de' live in Berlin's diverse cultural scene.,Upcoming,www.berlin.de,https://www.berlin.de/en/events/concerts/,See Official Site,"Berlin, Germany",experience 'weitere informationen zu berlin.de' live in berlin's diverse cultural scene.
Hauptstadtportal,Berlin.de ist ein Angebot des Landes Berlin.,Upcoming,www.berlin.de,https://www.berlin.de/en/events/concerts/,See Official Site,"Berlin, Germany",berlin.de ist ein angebot des landes berlin.
Politik & Verwaltung,Berlin.de ist ein Angebot des Landes Berlin.,Upcoming,www.berlin.de,https://www.berlin.de/en/events/concerts/,See Official Site,"Berlin, Germany",berlin.de ist ein angebot des landes berlin.
Berlin erleben,Berlin.de ist ein Angebot des Landes Berlin.,Upcoming,www.berlin.de,https://www.berlin.de/en/events/concerts/,See Official Site,"Berlin, Germany",berlin.de ist ein angebot des landes berlin.
In anderen Sprachen,Berlin.de ist ein Angebot des Landes Berlin.,Upcoming,www.berlin.de,https://www.berlin.de/en/events/concerts/,See Official Site,"Berlin, Germany",berlin.de ist ein angebot des landes berlin.
Accessibility,"How accessible is this website?Accessibility statementWho can you contact if you have questions, comments or feedback regarding digital accessibili...",Upcoming,www.berlin.de,https://www.berlin.de/en/events/party/,See Official Site,"Berlin, Germany","how accessible is this website?accessibility statementwho can you contact if you have questions, comments or feedback regarding digital accessibili..."
How accessible is this website?,"Open: SearchSearchSearchSchließen: SucheWo soll gesucht werden?Kultur, Tourismus und StadtlebenKomplette Webseite von Berlin.deSearch termSearch",Upcoming,www.berlin.de,https://www.berlin.de/en/events/party/,See Official Site,"Berlin, Germany","open: searchsearchsearchschließen: suchewo soll gesucht werden?kultur, tourismus und stadtlebenkomplette webseite von berlin.desearch termsearch"
Where can I find additional information about accessibility in Berlin?,"Open: SearchSearchSearchSchließen: SucheWo soll gesucht werden?Kultur, Tourismus und StadtlebenKomplette Webseite von Berlin.deSearch termSearch",Upcoming,www.berlin.de,https://www.berlin.de/en/events/party/,See Official Site,"Berlin, Germany","open: searchsearchsearchschließen: suchewo soll gesucht werden?kultur, tourismus und stadtlebenkomplette webseite von berlin.desearch termsearch"
Shows on New Year's Eve,Unfortunately no events are available at the moment.,Upcoming,www.berlin.de,https://www.berlin.de/en/events/party/,See Official Site,"Berlin, Germany",unfortunately no events are available at the moment.
New Year's Eve Parties,Experience 'New Year's Eve Parties' live in Berlin's diverse cultural scene.,Upcoming,www.berlin.de,https://www.berlin.de/en/events/party/,See Official Site,"Berlin, Germany",experience 'new year's eve parties' live in berlin's diverse cultural scene.
New Year's Eve Party at Brandenburg Gate,Date not yet confirmed,Upcoming,www.berlin.de,https://www.berlin.de/en/events/party/,See Official Site,"Berlin, Germany",date not yet confirmed
Classical Concerts on New Year's Eve,Unfortunately no events are available at the moment.,Upcoming,www.berlin.de,https://www.berlin.de/en/events/party/,See Official Site,"Berlin, Germany",unfortunately no events are available at the moment.
Musical & Opera on New Year's Eve,Unfortunately no events are available at the moment.,Upcoming,www.berlin.de,https://www.berlin.de/en/events/party/,See Official Site,"Berlin, Germany",unfortunately no events are available at the moment.
Christmas Markets,Experience 'Christmas Markets' live in Berlin's diverse cultural scene.,Upcoming,www.berlin.de,https://www.berlin.de/en/events/party/,See Official Site,"Berlin, Germany",experience 'christmas markets' live in berlin's diverse cultural scene.
Christmas Market on Gendarmenmarkt,"November 23 to December 31, 2026",Upcoming,www.berlin.de,https://www.berlin.de/en/events/party/,See Official Site,"Berlin, Germany","november 23 to december 31, 2026"
Christmas Market on Breitscheidplatz,"November 23, 2026 - January 03, 2027",Upcoming,www.berlin.de,https://www.berlin.de/en/events/party/,See Official Site,"Berlin, Germany","november 23, 2026 - january 03, 2027"
Winter World on Potsdamer Platz,Date not yet known,Upcoming,www.berlin.de,https://www.berlin.de/en/events/party/,See Official Site,"Berlin, Germany",date not yet known
Related Content,Experience 'Related Content' live in Berlin's diverse cultural scene.,Upcoming,www.berlin.de,https://www.berlin.de/en/events/party/,See Official Site,"Berlin, Germany",experience 'related content' live in berlin's diverse cultural scene.
Events in December,"Highlights of the Berlin culture program in December, including Christmas events, exhibitions, concerts, New Year's Eve celebrations and more.more",Upcoming,www.berlin.de,https://www.berlin.de/en/events/party/,See Official Site,"Berlin, Germany","highlights of the berlin culture program in december, including christmas events, exhibitions, concerts, new year's eve celebrations and more.more"
Events in January,"Highlights of the Berlin culture program in January: Green Week, Tanztage, CTM Festival, Transmediale, Sixday Race andmore",Upcoming,www.berlin.de,https://www.berlin.de/en/events/party/,See Official Site,"Berlin, Germany","highlights of the berlin culture program in january: green week, tanztage, ctm festival, transmediale, sixday race andmore"
Weekend Tips: What to Do This Weekend in Berlin,"July 24 to 26, 2026: Events, festivals, exhibitions and more things to do for your perfect weekend in Berlin.more",Upcoming,www.berlin.de,https://www.berlin.de/en/events/party/,See Official Site,"Berlin, Germany","july 24 to 26, 2026: events, festivals, exhibitions and more things to do for your perfect weekend in berlin.more"
Discover Berlin,Weathermax.18.5°Cmin.13.3°CExtended Forecast© till beck/stock.adobe.comFlea MarketsBerlin's most popular flea markets and antique markets with adre...,18.5,www.berlin.de,https://www.berlin.de/en/events/party/,See Official Site,"Berlin, Germany",weathermax.18.5°cmin.13.3°cextended forecast© till beck/stock.adobe.comflea marketsberlin's most popular flea markets and antique markets with adre...
Flea Markets,"Berlin's most popular flea markets and antique markets with adresses, opening hours, public transport and map",Upcoming,www.berlin.de,https://www.berlin.de/en/events/party/,See Official Site,"Berlin, Germany","berlin's most popular flea markets and antique markets with adresses, opening hours, public transport and map"
Weekend Tips,"July 24 to 26, 2026: Events, festivals, exhibitions and more things to do for your perfect weekend in Berlin",Upcoming,www.berlin.de,https://www.berlin.de/en/events/party/,See Official Site,"Berlin, Germany","july 24 to 26, 2026: events, festivals, exhibitions and more things to do for your perfect weekend in berlin"
River Cruises,"Boat trips in Berlin on Spree river, on Landwehr canal or over the Wannsee",Upcoming,www.berlin.de,https://www.berlin.de/en/events/party/,See Official Site,"Berlin, Germany","boat trips in berlin on spree river, on landwehr canal or over the wannsee"
Berlin's Districts,"Information on residential areas, infrastructure, events, local authorities and leisure activities",Upcoming,www.berlin.de,https://www.berlin.de/en/events/party/,See Official Site,"Berlin, Germany","information on residential areas, infrastructure, events, local authorities and leisure activities"
Attractions & Sights,"Berlin’s top attractions, palaces and monuments with address, photos, public transport details and",Upcoming,www.berlin.de,https://www.berlin.de/en/events/party/,See Official Site,"Berlin, Germany","berlin’s top attractions, palaces and monuments with address, photos, public transport details and"
Travel Information,"Train StationsPublic TransportAirport BERBerlin A-ZScooters, Bicycle & Car SharingWiFi in Berlin",Upcoming,www.berlin.de,https://www.berlin.de/en/events/party/,See Official Site,"Berlin, Germany","train stationspublic transportairport berberlin a-zscooters, bicycle & car sharingwifi in berlin"
Weitere Informationen zu diesem Auftritt,Experience 'Weitere Informationen zu diesem Auftritt' live in Berlin's diverse cultural scene.,Upcoming,www.berlin.de,https://www.berlin.de/en/events/party/,See Official Site,"Berlin, Germany",experience 'weitere informationen zu diesem auftritt' live in berlin's diverse cultural scene.
Official Website of Berlin,Berlin.de is a service of the State of Berlin.,Upcoming,www.berlin.de,https://www.berlin.de/en/events/party/,See Official Site,"Berlin, Germany",berlin.de is a service of the state of berlin.
Politics & Business,Berlin.de is a service of the State of Berlin.,Upcoming,www.berlin.de,https://www.berlin.de/en/events/party/,See Official Site,"Berlin, Germany",berlin.de is a service of the state of berlin.
New in Berlin,Berlin.de is a service of the State of Berlin.,Upcoming,www.berlin.de,https://www.berlin.de/en/events/party/,See Official Site,"Berlin, Germany",berlin.de is a service of the state of berlin.
What to see & do,Berlin.de is a service of the State of Berlin.,Upcoming,www.berlin.de,https://www.berlin.de/en/events/party/,See Official Site,"Berlin, Germany",berlin.de is a service of the state of berlin.
