title,description,date,source,url,price,address,description_clean
Barrierefreiheit,Wie barrierefrei ist diese Webseite?Erklärung zur BarrierefreiheitHaben Sie Anmerkungen oder Fragen zur Barrierefreiheit dieser Webseite?Kontakt zu...,Upcoming,www.berlin.de,https://www.berlin.de/en/events/concerts/,See Official Site,"Berlin, Germany",wie barrierefrei ist diese webseite?erklärung zur barrierefreiheithaben sie anmerkungen oder fragen zur barrierefreiheit dieser webseite?kontakt zu...
Wie barrierefrei ist diese Webseite?,"Öffnen: SucheSucheSucheSchließen: SucheWo soll gesucht werden?Kultur, Tourismus und StadtlebenKomplette Webseite von Berlin.deSuchbegriffSuchen",Upcoming,www.berlin.de,https://www.berlin.de/en/events/concerts/,See Official Site,"Berlin, Germany","öffnen: suchesuchesucheschließen: suchewo soll gesucht werden?kultur, tourismus und stadtlebenkomplette webseite von berlin.desuchbegriffsuchen"
Haben Sie Anmerkungen oder Fragen zur Barrierefreiheit dieser Webseite?,"Öffnen: SucheSucheSucheSchließen: SucheWo soll gesucht werden?Kultur, Tourismus und StadtlebenKomplette Webseite von Berlin.deSuchbegriffSuchen",Upcoming,www.berlin.de,https://www.berlin.de/en/events/concerts/,See Official Site,"Berlin, Germany","öffnen: suchesuchesucheschließen: suchewo soll gesucht werden?kultur, tourismus und stadtlebenkomplette webseite von berlin.desuchbegriffsuchen"
Wo gibt es zusätzliche Informationen zur Barrierefreiheit im Land Berlin?,"Öffnen: SucheSucheSucheSchließen: SucheWo soll gesucht werden?Kultur, Tourismus und StadtlebenKomplette Webseite von Berlin.deSuchbegriffSuchen",Upcoming,www.berlin.de,https://www.berlin.de/en/events/concerts/,See Official Site,"Berlin, Germany","öffnen: suchesuchesucheschließen: suchewo soll gesucht werden?kultur, tourismus und stadtlebenkomplette webseite von berlin.desuchbegriffsuchen"
Sprache der Webseite ändern,Die Seite wurde nicht gefunden.FehlerbeschreibungDie Rubrik existiert nicht.Finden Sie die gewünschten InformationenSuche auf Berlin.deSuchenKontak...,Upcoming,www.berlin.de,https://www.berlin.de/en/events/concerts/,See Official Site,"Berlin, Germany",die seite wurde nicht gefunden.fehlerbeschreibungdie rubrik existiert nicht.finden sie die gewünschten informationensuche auf berlin.desuchenkontak...
Weitere Links,Die Seite wurde nicht gefunden.FehlerbeschreibungDie Rubrik existiert nicht.Finden Sie die gewünschten InformationenSuche auf Berlin.deSuchenKontak...,Upcoming,www.berlin.de,https://www.berlin.de/en/events/concerts/,See Official Site,"Berlin, Germany",die seite wurde nicht gefunden.fehlerbeschreibungdie rubrik existiert nicht.finden sie die gewünschten informationensuche auf berlin.desuchenkontak...
Weitere Informationen zu Berlin.de,Experience 'Weitere Informationen zu Berlin.de' live in Berlin's diverse cultural scene.,Upcoming,www.berlin.de,https://www.berlin.de/en/events/concerts/,See Official Site,"Berlin, Germany",experience 'weitere informationen zu berlin.de' live in berlin's diverse cultural scene.
Hauptstadtportal,Berlin.de ist ein Angebot des Landes Berlin.,Upcoming,www.berlin.de,https://www.berlin.de/en/events/concerts/,See Official Site,"Berlin, Germany",berlin.de ist ein angebot des landes berlin.
Politik & Verwaltung,Berlin.de ist ein Angebot des Landes Berlin.,Upcoming,www.berlin.de,https://www.berlin.de/en/events/concerts/,See Official Site,"Berlin, Germany",berlin.de ist ein angebot des landes berlin.
Berlin erleben,Berlin.de ist ein Angebot des Landes Berlin.,Upcoming,www.berlin.de,https://www.berlin.de/en/events/concerts/,See Official Site,"Berlin, Germany",berlin.de ist ein angebot des landes berlin.
In anderen Sprachen,Berlin.de ist ein Angebot des Landes Berlin.,Upcoming,www.berlin.de,https://www.berlin.de/en/events/concerts/,See Official Site,"Berlin, Germany",berlin.de ist ein angebot des landes berlin.
Accessibility,"How accessible is this website?Accessibility statementWho can you contact if you have questions, comments or feedback regarding digital accessibili...",Upcoming,www.berlin.de,https://www.berlin.de/en/events/party/,See Official Site,"Berlin, Germany","how accessible is this website?accessibility statementwho can you contact if you have questions, comments or feedback regarding digital accessibili..."
How accessible is this website?,"Open: SearchSearchSearchSchließen: SucheWo soll gesucht werden?Kultur, Tourismus und StadtlebenKomplette Webseite von Berlin.deSearch termSearch",Upcoming,www.berlin.de,https://www.berlin.de/en/events/party/,See Official Site,"Berlin, Germany","open: searchsearchsearchschließen: suchewo soll gesucht werden?kultur, tourismus und stadtlebenkomplette webseite von berlin.desearch termsearch"
Where can I find additional information about accessibility in Berlin?,"Open: SearchSearchSearchSchließen: SucheWo soll gesucht werden?Kultur, Tourismus und StadtlebenKomplette Webseite von Berlin.deSearch termSearch",Upcoming,www.berlin.de,https://www.berlin.de/en/events/party/,See Official Site,"Berlin, Germany","open: searchsearchsearchschließen: suchewo soll gesucht werden?kultur, tourismus und stadtlebenkomplette webseite von berlin.desearch termsearch"
Shows on New Year's Eve,Unfortunately no events are available at the moment.,Upcoming,www.berlin.de,https://www.berlin.de/en/events/party/,See Official Site,"Berlin, Germany",unfortunately no events are available at the moment.
New Year's Eve Parties,Experience 'New Year's Eve Parties' live in Berlin's diverse cultural scene.,Upcoming,www.berlin.de,https://www.berlin.de/en/events/party/,See Official Site,"Berlin, Germany",experience 'new year's eve parties' live in berlin's diverse cultural scene.
New Year's Eve Party at Brandenburg Gate,Date not yet confirmed,Upcoming,www.berlin.de,https://www.berlin.de/en/events/party/,See Official Site,"Berlin, Germany",date not yet confirmed
Classical Concerts on New Year's Eve,Unfortunately no events are available at the moment.,Upcoming,www.berlin.de,https://www.berlin.de/en/events/party/,See Official Site,"Berlin, Germany",unfortunately no events are available at the moment.
Musical & Opera on New Year's Eve,Unfortunately no events are available at the moment.,Upcoming,www.berlin.de,https://www.berlin.de/en/events/party/,See Official Site,"Berlin, Germany",unfortunately no events are available at the moment.
Christmas Markets,Experience 'Christmas Markets' live in Berlin's diverse cultural scene.,Upcoming,www.berlin.de,https://www.berlin.de/en/events/party/,See Official Site,"Berlin, Germany",experience 'christmas markets' live in berlin's diverse cultural scene.
Christmas Market on Gendarmenmarkt,"November 23 to December 31, 2026",Upcoming,www.berlin.de,https://www.berlin.de/en/events/party/,See Official Site,"Berlin, Germany","november 23 to december 31, 2026"
Christmas Market on Breitscheidplatz,"November 23, 2026 - January 03, 2027",Upcoming,www.berlin.de,https://www.berlin.de/en/events/party/,See Official Site,"Berlin, Germany","november 23, 2026 - january 03, 2027"
Winter World on Potsdamer Platz,Date not yet known,Upcoming,www.berlin.de,https://www.berlin.de/en/events/party/,See Official Site,"Berlin, Germany",date not yet known
Related Content,Experience 'Related Content' live in Berlin's diverse cultural scene.,Upcoming,www.berlin.de,https://www.berlin.de/en/events/party/,See Official Site,"Berlin, Germany",experience 'related content' live in berlin's diverse cultural scene.
Events in December,"Highlights of the Berlin culture program in December, including Christmas events, exhibitions, concerts, New Year's Eve celebrations and more.more",Upcoming,www.berlin.de,https://www.berlin.de/en/events/party/,See Official Site,"Berlin, Germany","highlights of the berlin culture program in december, including christmas events, exhibitions, concerts, new year's eve celebrations and more.more"
Events in January,"Highlights of the Berlin culture program in January: Green Week, Tanztage, CTM Festival, Transmediale, Sixday Race andmore",Upcoming,www.berlin.de,https://www.berlin.de/en/events/party/,See Official Site,"Berlin, Germany","highlights of the berlin culture program in january: green week, tanztage, ctm festival, transmediale, sixday race andmore"
Weekend Tips: What to Do This Weekend in Berlin,"July 10 to 12, 2026: Events, festivals, exhibitions and more things to do for your perfect weekend in Berlin.more",Upcoming,www.berlin.de,https://www.berlin.de/en/events/party/,See Official Site,"Berlin, Germany","july 10 to 12, 2026: events, festivals, exhibitions and more things to do for your perfect weekend in berlin.more"
Discover Berlin,Weathermax.21.2°Cmin.14.4°CExtended Forecast© dpaEvents & Culture in BerlinHighlights of the Berlin culture program including tips for the best con...,21.2,www.berlin.de,https://www.berlin.de/en/events/party/,See Official Site,"Berlin, Germany",weathermax.21.2°cmin.14.4°cextended forecast© dpaevents & culture in berlinhighlights of the berlin culture program including tips for the best con...
Events & Culture in Berlin,"Highlights of the Berlin culture program including tips for the best concerts, exhibitions, trade fairs, seasonal events and specials",Upcoming,www.berlin.de,https://www.berlin.de/en/events/party/,See Official Site,"Berlin, Germany","highlights of the berlin culture program including tips for the best concerts, exhibitions, trade fairs, seasonal events and specials"
Exhibitions in Berlin,"See the best museum, art and photography exhibitions at Berlin's top museums, galleries and event venues",Upcoming,www.berlin.de,https://www.berlin.de/en/events/party/,See Official Site,"Berlin, Germany","see the best museum, art and photography exhibitions at berlin's top museums, galleries and event venues"
Flea Markets,"Berlin's most popular flea markets and antique markets with adresses, opening hours, public transport and map",Upcoming,www.berlin.de,https://www.berlin.de/en/events/party/,See Official Site,"Berlin, Germany","berlin's most popular flea markets and antique markets with adresses, opening hours, public transport and map"
Weekend Tips,"July 10 to 12, 2026: Events, festivals, exhibitions and more things to do for your perfect weekend in Berlin",Upcoming,www.berlin.de,https://www.berlin.de/en/events/party/,See Official Site,"Berlin, Germany","july 10 to 12, 2026: events, festivals, exhibitions and more things to do for your perfect weekend in berlin"
River Cruises,"Boat trips in Berlin on Spree river, on Landwehr canal or over the Wannsee",Upcoming,www.berlin.de,https://www.berlin.de/en/events/party/,See Official Site,"Berlin, Germany","boat trips in berlin on spree river, on landwehr canal or over the wannsee"
Travel Information,"Train StationsPublic TransportAirport BERBerlin A-ZScooters, Bicycle & Car SharingWiFi in Berlin",Upcoming,www.berlin.de,https://www.berlin.de/en/events/party/,See Official Site,"Berlin, Germany","train stationspublic transportairport berberlin a-zscooters, bicycle & car sharingwifi in berlin"
Weitere Informationen zu diesem Auftritt,Experience 'Weitere Informationen zu diesem Auftritt' live in Berlin's diverse cultural scene.,Upcoming,www.berlin.de,https://www.berlin.de/en/events/party/,See Official Site,"Berlin, Germany",experience 'weitere informationen zu diesem auftritt' live in berlin's diverse cultural scene.
Official Website of Berlin,Berlin.de is a service of the State of Berlin.,Upcoming,www.berlin.de,https://www.berlin.de/en/events/party/,See Official Site,"Berlin, Germany",berlin.de is a service of the state of berlin.
Politics & Business,Berlin.de is a service of the State of Berlin.,Upcoming,www.berlin.de,https://www.berlin.de/en/events/party/,See Official Site,"Berlin, Germany",berlin.de is a service of the state of berlin.
New in Berlin,Berlin.de is a service of the State of Berlin.,Upcoming,www.berlin.de,https://www.berlin.de/en/events/party/,See Official Site,"Berlin, Germany",berlin.de is a service of the state of berlin.
What to see & do,Berlin.de is a service of the State of Berlin.,Upcoming,www.berlin.de,https://www.berlin.de/en/events/party/,See Official Site,"Berlin, Germany",berlin.de is a service of the state of berlin.
"Berlin kostenlos erleben - täglich neue Events, Veranstaltungen, Tips!",Home>Heute gratis in Berlin,Upcoming,www.gratis-in-berlin.de,https://www.gratis-in-berlin.de/heute,Free / Kostenlos,"Berlin, Germany",home>heute gratis in berlin
Meine Großmutter ist Fallschirmspringerin I Ein Film von Polina Piddubna,Experience 'Meine Großmutter ist Fallschirmspringerin I Ein Film von Polina Piddubna' live in Berlin's diverse cultural scene.,Upcoming,www.gratis-in-berlin.de,https://www.gratis-in-berlin.de/heute,Free / Kostenlos,"Berlin, Germany",experience 'meine großmutter ist fallschirmspringerin i ein film von polina piddubna' live in berlin's diverse cultural scene.
"Kiez Sudoku - Brüsseler Eck, Wedding","Experience 'Kiez Sudoku - Brüsseler Eck, Wedding' live in Berlin's diverse cultural scene.",Upcoming,www.gratis-in-berlin.de,https://www.gratis-in-berlin.de/heute,Free / Kostenlos,"Berlin, Germany","experience 'kiez sudoku - brüsseler eck, wedding' live in berlin's diverse cultural scene."
Lesung und Gespräch,Experience 'Lesung und Gespräch' live in Berlin's diverse cultural scene.,Upcoming,www.gratis-in-berlin.de,https://www.gratis-in-berlin.de/heute,Free / Kostenlos,"Berlin, Germany",experience 'lesung und gespräch' live in berlin's diverse cultural scene.
Ausstellungseröffnung: Deine Geschichte zählt,Experience 'Ausstellungseröffnung: Deine Geschichte zählt' live in Berlin's diverse cultural scene.,Upcoming,www.gratis-in-berlin.de,https://www.gratis-in-berlin.de/heute,Free / Kostenlos,"Berlin, Germany",experience 'ausstellungseröffnung: deine geschichte zählt' live in berlin's diverse cultural scene.
Engagement lokal – Zusammen Zukunft machen in der Ingeborg-Drewitz-Bibliothek,Experience 'Engagement lokal – Zusammen Zukunft machen in der Ingeborg-Drewitz-Bibliothek' live in Berlin's diverse cultural scene.,Upcoming,www.gratis-in-berlin.de,https://www.gratis-in-berlin.de/heute,Free / Kostenlos,"Berlin, Germany",experience 'engagement lokal – zusammen zukunft machen in der ingeborg-drewitz-bibliothek' live in berlin's diverse cultural scene.
Vincenzo Latronico | Berlin in Books,Experience 'Vincenzo Latronico | Berlin in Books' live in Berlin's diverse cultural scene.,Upcoming,www.gratis-in-berlin.de,https://www.gratis-in-berlin.de/heute,Free / Kostenlos,"Berlin, Germany",experience 'vincenzo latronico | berlin in books' live in berlin's diverse cultural scene.
Berlin Basics | Führung durch die Berlin-Sammlungen,Experience 'Berlin Basics | Führung durch die Berlin-Sammlungen' live in Berlin's diverse cultural scene.,Upcoming,www.gratis-in-berlin.de,https://www.gratis-in-berlin.de/heute,Free / Kostenlos,"Berlin, Germany",experience 'berlin basics | führung durch die berlin-sammlungen' live in berlin's diverse cultural scene.
Demenz im Alltag,Experience 'Demenz im Alltag' live in Berlin's diverse cultural scene.,Upcoming,www.gratis-in-berlin.de,https://www.gratis-in-berlin.de/heute,Free / Kostenlos,"Berlin, Germany",experience 'demenz im alltag' live in berlin's diverse cultural scene.
Lesung: Tomer Gardi „Liefern“,Experience 'Lesung: Tomer Gardi „Liefern“' live in Berlin's diverse cultural scene.,Upcoming,www.gratis-in-berlin.de,https://www.gratis-in-berlin.de/heute,Free / Kostenlos,"Berlin, Germany",experience 'lesung: tomer gardi „liefern“' live in berlin's diverse cultural scene.
Ausstellung für Familien – FROM PIXEL TO POSSIBILITY,Heute  bis Mittwoch 08.07.2026,08.07.2026,www.gratis-in-berlin.de,https://www.gratis-in-berlin.de/heute,Free / Kostenlos,"Berlin, Germany",heute  bis mittwoch 08.07.2026
Tanz mit! – Kostenloses Tanzfestival am Potsdamer Platz (tägl.),Heute  bis Samstag 11.07.2026,11.07.2026,www.gratis-in-berlin.de,https://www.gratis-in-berlin.de/heute,Free / Kostenlos,"Berlin, Germany",heute  bis samstag 11.07.2026
Ausstellung: Lichcht - Hermanni Härmälä & Dud Nabel,Heute  bis Samstag 11.07.2026,11.07.2026,www.gratis-in-berlin.de,https://www.gratis-in-berlin.de/heute,Free / Kostenlos,"Berlin, Germany",heute  bis samstag 11.07.2026
Fashion Open Air auf Alexanderplatz,Heute  bis Sonntag 12.07.2026,12.07.2026,www.gratis-in-berlin.de,https://www.gratis-in-berlin.de/heute,Free / Kostenlos,"Berlin, Germany",heute  bis sonntag 12.07.2026
Oneironautentraining (Klartraumtraining),Heute  bis Mittwoch 15.07.2026,15.07.2026,www.gratis-in-berlin.de,https://www.gratis-in-berlin.de/heute,Free / Kostenlos,"Berlin, Germany",heute  bis mittwoch 15.07.2026
Yu-Gi-Oh! Duell-Arena,Heute  bis Donnerstag 16.07.2026,16.07.2026,www.gratis-in-berlin.de,https://www.gratis-in-berlin.de/heute,Free / Kostenlos,"Berlin, Germany",heute  bis donnerstag 16.07.2026
100 Jahre Christa Düll und Horst Heinen (Mo-Sa),Heute  bis Samstag 18.07.2026,18.07.2026,www.gratis-in-berlin.de,https://www.gratis-in-berlin.de/heute,Free / Kostenlos,"Berlin, Germany",heute  bis samstag 18.07.2026
Trace (Mo-Sa 12-20 Uhr),Heute  bis Samstag 18.07.2026,18.07.2026,www.gratis-in-berlin.de,https://www.gratis-in-berlin.de/heute,Free / Kostenlos,"Berlin, Germany",heute  bis samstag 18.07.2026
"Die Aktgalerie / ""The Nudes of Istanbul"" von Burak Bulut Yildirim (Fr-Sa-So)",Heute  bis Sonntag 19.07.2026,19.07.2026,www.gratis-in-berlin.de,https://www.gratis-in-berlin.de/heute,Free / Kostenlos,"Berlin, Germany",heute  bis sonntag 19.07.2026
WM 2026 Fanmeile PublicViewing? Andere gute Locations,Heute  bis Sonntag 19.07.2026,19.07.2026,www.gratis-in-berlin.de,https://www.gratis-in-berlin.de/heute,Free / Kostenlos,"Berlin, Germany",heute  bis sonntag 19.07.2026
WM Public Viewing im ART Stalker Berlin Charlottenburg,Heute  bis Sonntag 19.07.2026,19.07.2026,www.gratis-in-berlin.de,https://www.gratis-in-berlin.de/heute,Free / Kostenlos,"Berlin, Germany",heute  bis sonntag 19.07.2026
Fußball-Sommer im Center am Potsdamer Platz,Heute  bis Sonntag 19.07.2026,19.07.2026,www.gratis-in-berlin.de,https://www.gratis-in-berlin.de/heute,Free / Kostenlos,"Berlin, Germany",heute  bis sonntag 19.07.2026
Meilenstein Strassenfest Event (täglich),Heute  bis Montag 20.07.2026,20.07.2026,www.gratis-in-berlin.de,https://www.gratis-in-berlin.de/heute,Free / Kostenlos,"Berlin, Germany",heute  bis montag 20.07.2026
Zwischen Werk und Spiel,Heute  bis Samstag 25.07.2026,25.07.2026,www.gratis-in-berlin.de,https://www.gratis-in-berlin.de/heute,Free / Kostenlos,"Berlin, Germany",heute  bis samstag 25.07.2026
Ausstellung im Frauentreffpunkt Ratswaag,Heute  bis Sonntag 26.07.2026,26.07.2026,www.gratis-in-berlin.de,https://www.gratis-in-berlin.de/heute,Free / Kostenlos,"Berlin, Germany",heute  bis sonntag 26.07.2026
Kunst- und Kreativmarkt (Arts & Crafts Market) | Creative Summer Potsdamer Platz,Heute  bis Samstag 01.08.2026,01.08.2026,www.gratis-in-berlin.de,https://www.gratis-in-berlin.de/heute,Free / Kostenlos,"Berlin, Germany",heute  bis samstag 01.08.2026
ABITARE - ein immersives Projekt von Samanta Malavasi,Heute  bis Samstag 01.08.2026,01.08.2026,www.gratis-in-berlin.de,https://www.gratis-in-berlin.de/heute,Free / Kostenlos,"Berlin, Germany",heute  bis samstag 01.08.2026
"Elementar - Hand, Klang, Natur",Heute  bis Samstag 01.08.2026,01.08.2026,www.gratis-in-berlin.de,https://www.gratis-in-berlin.de/heute,Free / Kostenlos,"Berlin, Germany",heute  bis samstag 01.08.2026
Dora Budor & Noah Barker (DI-FR),Heute  bis Sonntag 02.08.2026,02.08.2026,www.gratis-in-berlin.de,https://www.gratis-in-berlin.de/heute,Free / Kostenlos,"Berlin, Germany",heute  bis sonntag 02.08.2026
Berlin plant. Stunde Null (DI-SO),Heute  bis Sonntag 02.08.2026,02.08.2026,www.gratis-in-berlin.de,https://www.gratis-in-berlin.de/heute,Free / Kostenlos,"Berlin, Germany",heute  bis sonntag 02.08.2026
"Wohnzimmer - Ausstellung, Installation, Workshop (Mi - Mo)",Heute  bis Montag 03.08.2026,03.08.2026,www.gratis-in-berlin.de,https://www.gratis-in-berlin.de/heute,Free / Kostenlos,"Berlin, Germany",heute  bis montag 03.08.2026
Systemrelevant: Frauen in Herrscherfamilien (Mi - Mo),Heute  bis Montag 03.08.2026,03.08.2026,www.gratis-in-berlin.de,https://www.gratis-in-berlin.de/heute,Free / Kostenlos,"Berlin, Germany",heute  bis montag 03.08.2026
Ausstellung “Unlock the Future - Bildungsgerechtigkeit: Schlüssel zur Zukunft“,Heute  bis Samstag 08.08.2026,08.08.2026,www.gratis-in-berlin.de,https://www.gratis-in-berlin.de/heute,Free / Kostenlos,"Berlin, Germany",heute  bis samstag 08.08.2026
"Die Sommer Challenge - Lesen, hören, sehen und gewinnen!",Heute  bis Samstag 22.08.2026,22.08.2026,www.gratis-in-berlin.de,https://www.gratis-in-berlin.de/heute,Free / Kostenlos,"Berlin, Germany",heute  bis samstag 22.08.2026
Ferienprogramm in der Kinder- und Jugendbibliothek der ZLB,Heute  bis Sonntag 30.08.2026,30.08.2026,www.gratis-in-berlin.de,https://www.gratis-in-berlin.de/heute,Free / Kostenlos,"Berlin, Germany",heute  bis sonntag 30.08.2026
"Fotoausstellung: „Shadows, Motion“",Heute  bis Sonntag 30.08.2026,30.08.2026,www.gratis-in-berlin.de,https://www.gratis-in-berlin.de/heute,Free / Kostenlos,"Berlin, Germany",heute  bis sonntag 30.08.2026
Kolonnaden Bar auf Museumsinsel mit Musik (Mi - So),Heute  bis Montag 31.08.2026,31.08.2026,www.gratis-in-berlin.de,https://www.gratis-in-berlin.de/heute,Free / Kostenlos,"Berlin, Germany",heute  bis montag 31.08.2026
Nora Turato (Rund um die Uhr geöffnet),Heute  bis Montag 31.08.2026,31.08.2026,www.gratis-in-berlin.de,https://www.gratis-in-berlin.de/heute,Free / Kostenlos,"Berlin, Germany",heute  bis montag 31.08.2026
Ausstellung: Das verbindende Element - artspring berlin,Heute  bis Dienstag 01.09.2026,01.09.2026,www.gratis-in-berlin.de,https://www.gratis-in-berlin.de/heute,Free / Kostenlos,"Berlin, Germany",heute  bis dienstag 01.09.2026
Hélène Fauriat | Von der Résistance zur Zwangsarbeit in Schönefeld,Heute  bis Sonntag 06.09.2026,06.09.2026,www.gratis-in-berlin.de,https://www.gratis-in-berlin.de/heute,Free / Kostenlos,"Berlin, Germany",heute  bis sonntag 06.09.2026
Generationenübergreifende Tanzworkshops in Lichtenrade,Heute  bis Sonntag 27.09.2026,27.09.2026,www.gratis-in-berlin.de,https://www.gratis-in-berlin.de/heute,Free / Kostenlos,"Berlin, Germany",heute  bis sonntag 27.09.2026
Ausstellung: Deutungsräume - Vielschichtige Bildwelten (Mo. - Fr.),Heute  bis Freitag 09.10.2026,09.10.2026,www.gratis-in-berlin.de,https://www.gratis-in-berlin.de/heute,Free / Kostenlos,"Berlin, Germany",heute  bis freitag 09.10.2026
Nebelskulptur in Neuer Nationalgalerie- auch von oben,Heute  bis Sonntag 25.10.2026,25.10.2026,www.gratis-in-berlin.de,https://www.gratis-in-berlin.de/heute,Free / Kostenlos,"Berlin, Germany",heute  bis sonntag 25.10.2026
Forced to Work | Willing to Survive,Heute  bis Sonntag 25.10.2026,25.10.2026,www.gratis-in-berlin.de,https://www.gratis-in-berlin.de/heute,Free / Kostenlos,"Berlin, Germany",heute  bis sonntag 25.10.2026
"Ausstellung ""A Place to Stay"" im Spreepark Art Space (Mi - So)",Heute  bis Sonntag 01.11.2026,01.11.2026,www.gratis-in-berlin.de,https://www.gratis-in-berlin.de/heute,Free / Kostenlos,"Berlin, Germany",heute  bis sonntag 01.11.2026
Ostgebiete / Ziemie Zachodnie. Eine deutsch-polnische Spurensuche,Heute  bis Sonntag 17.01.2027,17.01.2027,www.gratis-in-berlin.de,https://www.gratis-in-berlin.de/heute,Free / Kostenlos,"Berlin, Germany",heute  bis sonntag 17.01.2027
Skater & Rollbrettfahrer vor und nach dem Mauerfall,Heute  bis Sonntag 04.04.2027,04.04.2027,www.gratis-in-berlin.de,https://www.gratis-in-berlin.de/heute,Free / Kostenlos,"Berlin, Germany",heute  bis sonntag 04.04.2027
Leseabend von textcollective,Jeden 4.			Dienstag,Upcoming,www.gratis-in-berlin.de,https://www.gratis-in-berlin.de/heute,Free / Kostenlos,"Berlin, Germany",jeden 4.			dienstag
Diskussions- und Literaturcafé,Jeden 3.			Dienstag,Upcoming,www.gratis-in-berlin.de,https://www.gratis-in-berlin.de/heute,Free / Kostenlos,"Berlin, Germany",jeden 3.			dienstag
architektonische Landschaftsbilder aus Moos und Holzresten gestalten,Jeden			Dienstag,Upcoming,www.gratis-in-berlin.de,https://www.gratis-in-berlin.de/heute,Free / Kostenlos,"Berlin, Germany",jeden			dienstag
Zocknachmittag in der Pop-Up-Else,Jeden 2.			Dienstag,Upcoming,www.gratis-in-berlin.de,https://www.gratis-in-berlin.de/heute,Free / Kostenlos,"Berlin, Germany",jeden 2.			dienstag
Solicafé Limon,Jeden			Dienstag,Upcoming,www.gratis-in-berlin.de,https://www.gratis-in-berlin.de/heute,Free / Kostenlos,"Berlin, Germany",jeden			dienstag
Gemeinsam statt allein - Digitales verstehen!,Jeden			Dienstag,Upcoming,www.gratis-in-berlin.de,https://www.gratis-in-berlin.de/heute,Free / Kostenlos,"Berlin, Germany",jeden			dienstag
Erzählspaziergang für Menschen 55+,Jeden 4.			Dienstag,Upcoming,www.gratis-in-berlin.de,https://www.gratis-in-berlin.de/heute,Free / Kostenlos,"Berlin, Germany",jeden 4.			dienstag
"Häkelclub ""Jung und Alt""",Alle 14 Tage			Dienstag,Upcoming,www.gratis-in-berlin.de,https://www.gratis-in-berlin.de/heute,Free / Kostenlos,"Berlin, Germany",alle 14 tage			dienstag
Sport im Park: Inlineskaten und Skaterhockey für die ganze Familie,Jeden			Dienstag,Upcoming,www.gratis-in-berlin.de,https://www.gratis-in-berlin.de/heute,Free / Kostenlos,"Berlin, Germany",jeden			dienstag
Spaßiges Sprachcafé - Deutsch lernen mit Jung und Alt,Jeden			Dienstag,Upcoming,www.gratis-in-berlin.de,https://www.gratis-in-berlin.de/heute,Free / Kostenlos,"Berlin, Germany",jeden			dienstag
"Ganzkörpertraining, Wiesenpark",Jeden			Dienstag,Upcoming,www.gratis-in-berlin.de,https://www.gratis-in-berlin.de/heute,Free / Kostenlos,"Berlin, Germany",jeden			dienstag
"Qigong und Tai Chi, Weichselplatz",Jeden			Dienstag,Upcoming,www.gratis-in-berlin.de,https://www.gratis-in-berlin.de/heute,Free / Kostenlos,"Berlin, Germany",jeden			dienstag
