title,description,date,source,url,price,address,description_clean
Barrierefreiheit,Wie barrierefrei ist diese Webseite?Erklärung zur BarrierefreiheitHaben Sie Anmerkungen oder Fragen zur Barrierefreiheit dieser Webseite?Kontakt zu...,Upcoming,www.berlin.de,https://www.berlin.de/en/events/concerts/,See Official Site,"Berlin, Germany",wie barrierefrei ist diese webseite?erklärung zur barrierefreiheithaben sie anmerkungen oder fragen zur barrierefreiheit dieser webseite?kontakt zu...
Wie barrierefrei ist diese Webseite?,"Öffnen: SucheSucheSucheSchließen: SucheWo soll gesucht werden?Kultur, Tourismus und StadtlebenKomplette Webseite von Berlin.deSuchbegriffSuchen",Upcoming,www.berlin.de,https://www.berlin.de/en/events/concerts/,See Official Site,"Berlin, Germany","öffnen: suchesuchesucheschließen: suchewo soll gesucht werden?kultur, tourismus und stadtlebenkomplette webseite von berlin.desuchbegriffsuchen"
Haben Sie Anmerkungen oder Fragen zur Barrierefreiheit dieser Webseite?,"Öffnen: SucheSucheSucheSchließen: SucheWo soll gesucht werden?Kultur, Tourismus und StadtlebenKomplette Webseite von Berlin.deSuchbegriffSuchen",Upcoming,www.berlin.de,https://www.berlin.de/en/events/concerts/,See Official Site,"Berlin, Germany","öffnen: suchesuchesucheschließen: suchewo soll gesucht werden?kultur, tourismus und stadtlebenkomplette webseite von berlin.desuchbegriffsuchen"
Wo gibt es zusätzliche Informationen zur Barrierefreiheit im Land Berlin?,"Öffnen: SucheSucheSucheSchließen: SucheWo soll gesucht werden?Kultur, Tourismus und StadtlebenKomplette Webseite von Berlin.deSuchbegriffSuchen",Upcoming,www.berlin.de,https://www.berlin.de/en/events/concerts/,See Official Site,"Berlin, Germany","öffnen: suchesuchesucheschließen: suchewo soll gesucht werden?kultur, tourismus und stadtlebenkomplette webseite von berlin.desuchbegriffsuchen"
Sprache der Webseite ändern,Die Seite wurde nicht gefunden.FehlerbeschreibungDie Rubrik existiert nicht.Finden Sie die gewünschten InformationenSuche auf Berlin.deSuchenKontak...,Upcoming,www.berlin.de,https://www.berlin.de/en/events/concerts/,See Official Site,"Berlin, Germany",die seite wurde nicht gefunden.fehlerbeschreibungdie rubrik existiert nicht.finden sie die gewünschten informationensuche auf berlin.desuchenkontak...
Weitere Links,Die Seite wurde nicht gefunden.FehlerbeschreibungDie Rubrik existiert nicht.Finden Sie die gewünschten InformationenSuche auf Berlin.deSuchenKontak...,Upcoming,www.berlin.de,https://www.berlin.de/en/events/concerts/,See Official Site,"Berlin, Germany",die seite wurde nicht gefunden.fehlerbeschreibungdie rubrik existiert nicht.finden sie die gewünschten informationensuche auf berlin.desuchenkontak...
Weitere Informationen zu Berlin.de,Experience 'Weitere Informationen zu Berlin.de' live in Berlin's diverse cultural scene.,Upcoming,www.berlin.de,https://www.berlin.de/en/events/concerts/,See Official Site,"Berlin, Germany",experience 'weitere informationen zu berlin.de' live in berlin's diverse cultural scene.
Hauptstadtportal,Berlin.de ist ein Angebot des Landes Berlin.,Upcoming,www.berlin.de,https://www.berlin.de/en/events/concerts/,See Official Site,"Berlin, Germany",berlin.de ist ein angebot des landes berlin.
Politik & Verwaltung,Berlin.de ist ein Angebot des Landes Berlin.,Upcoming,www.berlin.de,https://www.berlin.de/en/events/concerts/,See Official Site,"Berlin, Germany",berlin.de ist ein angebot des landes berlin.
Berlin erleben,Berlin.de ist ein Angebot des Landes Berlin.,Upcoming,www.berlin.de,https://www.berlin.de/en/events/concerts/,See Official Site,"Berlin, Germany",berlin.de ist ein angebot des landes berlin.
In anderen Sprachen,Berlin.de ist ein Angebot des Landes Berlin.,Upcoming,www.berlin.de,https://www.berlin.de/en/events/concerts/,See Official Site,"Berlin, Germany",berlin.de ist ein angebot des landes berlin.
Accessibility,"How accessible is this website?Accessibility statementWho can you contact if you have questions, comments or feedback regarding digital accessibili...",Upcoming,www.berlin.de,https://www.berlin.de/en/events/party/,See Official Site,"Berlin, Germany","how accessible is this website?accessibility statementwho can you contact if you have questions, comments or feedback regarding digital accessibili..."
How accessible is this website?,"Open: SearchSearchSearchSchließen: SucheWo soll gesucht werden?Kultur, Tourismus und StadtlebenKomplette Webseite von Berlin.deSearch termSearch",Upcoming,www.berlin.de,https://www.berlin.de/en/events/party/,See Official Site,"Berlin, Germany","open: searchsearchsearchschließen: suchewo soll gesucht werden?kultur, tourismus und stadtlebenkomplette webseite von berlin.desearch termsearch"
Where can I find additional information about accessibility in Berlin?,"Open: SearchSearchSearchSchließen: SucheWo soll gesucht werden?Kultur, Tourismus und StadtlebenKomplette Webseite von Berlin.deSearch termSearch",Upcoming,www.berlin.de,https://www.berlin.de/en/events/party/,See Official Site,"Berlin, Germany","open: searchsearchsearchschließen: suchewo soll gesucht werden?kultur, tourismus und stadtlebenkomplette webseite von berlin.desearch termsearch"
Shows on New Year's Eve,Unfortunately no events are available at the moment.,Upcoming,www.berlin.de,https://www.berlin.de/en/events/party/,See Official Site,"Berlin, Germany",unfortunately no events are available at the moment.
New Year's Eve Parties,Experience 'New Year's Eve Parties' live in Berlin's diverse cultural scene.,Upcoming,www.berlin.de,https://www.berlin.de/en/events/party/,See Official Site,"Berlin, Germany",experience 'new year's eve parties' live in berlin's diverse cultural scene.
New Year's Eve Party at Brandenburg Gate,Date not yet confirmed,Upcoming,www.berlin.de,https://www.berlin.de/en/events/party/,See Official Site,"Berlin, Germany",date not yet confirmed
Classical Concerts on New Year's Eve,Unfortunately no events are available at the moment.,Upcoming,www.berlin.de,https://www.berlin.de/en/events/party/,See Official Site,"Berlin, Germany",unfortunately no events are available at the moment.
Musical & Opera on New Year's Eve,Unfortunately no events are available at the moment.,Upcoming,www.berlin.de,https://www.berlin.de/en/events/party/,See Official Site,"Berlin, Germany",unfortunately no events are available at the moment.
Christmas Markets,Experience 'Christmas Markets' live in Berlin's diverse cultural scene.,Upcoming,www.berlin.de,https://www.berlin.de/en/events/party/,See Official Site,"Berlin, Germany",experience 'christmas markets' live in berlin's diverse cultural scene.
Christmas Market on Gendarmenmarkt,"November 23 to December 31, 2026",Upcoming,www.berlin.de,https://www.berlin.de/en/events/party/,See Official Site,"Berlin, Germany","november 23 to december 31, 2026"
Christmas Market on Breitscheidplatz,"November 23, 2026 - January 03, 2027",Upcoming,www.berlin.de,https://www.berlin.de/en/events/party/,See Official Site,"Berlin, Germany","november 23, 2026 - january 03, 2027"
Winter World on Potsdamer Platz,Date not yet known,Upcoming,www.berlin.de,https://www.berlin.de/en/events/party/,See Official Site,"Berlin, Germany",date not yet known
Related Content,Experience 'Related Content' live in Berlin's diverse cultural scene.,Upcoming,www.berlin.de,https://www.berlin.de/en/events/party/,See Official Site,"Berlin, Germany",experience 'related content' live in berlin's diverse cultural scene.
Events in December,"Highlights of the Berlin culture program in December, including Christmas events, exhibitions, concerts, New Year's Eve celebrations and more.more",Upcoming,www.berlin.de,https://www.berlin.de/en/events/party/,See Official Site,"Berlin, Germany","highlights of the berlin culture program in december, including christmas events, exhibitions, concerts, new year's eve celebrations and more.more"
Events in January,"Highlights of the Berlin culture program in January: Green Week, Tanztage, CTM Festival, Transmediale, Sixday Race andmore",Upcoming,www.berlin.de,https://www.berlin.de/en/events/party/,See Official Site,"Berlin, Germany","highlights of the berlin culture program in january: green week, tanztage, ctm festival, transmediale, sixday race andmore"
Weekend Tips: What to Do This Weekend in Berlin,"July 3 to 5, 2026: Events, festivals, exhibitions and more things to do for your perfect weekend in Berlin.more",Upcoming,www.berlin.de,https://www.berlin.de/en/events/party/,See Official Site,"Berlin, Germany","july 3 to 5, 2026: events, festivals, exhibitions and more things to do for your perfect weekend in berlin.more"
Discover Berlin,"Weathermax.27.3°Cmin.16.9°CExtended Forecast© dpaExhibitions in BerlinSee the best museum, art and photography exhibitions at Berlin's top museums,...",27.3,www.berlin.de,https://www.berlin.de/en/events/party/,See Official Site,"Berlin, Germany","weathermax.27.3°cmin.16.9°cextended forecast© dpaexhibitions in berlinsee the best museum, art and photography exhibitions at berlin's top museums,..."
Exhibitions in Berlin,"See the best museum, art and photography exhibitions at Berlin's top museums, galleries and event venues",Upcoming,www.berlin.de,https://www.berlin.de/en/events/party/,See Official Site,"Berlin, Germany","see the best museum, art and photography exhibitions at berlin's top museums, galleries and event venues"
Flea Markets,"Berlin's most popular flea markets and antique markets with adresses, opening hours, public transport and map",Upcoming,www.berlin.de,https://www.berlin.de/en/events/party/,See Official Site,"Berlin, Germany","berlin's most popular flea markets and antique markets with adresses, opening hours, public transport and map"
Weekend Tips,"July 3 to 5, 2026: Events, festivals, exhibitions and more things to do for your perfect weekend in Berlin",Upcoming,www.berlin.de,https://www.berlin.de/en/events/party/,See Official Site,"Berlin, Germany","july 3 to 5, 2026: events, festivals, exhibitions and more things to do for your perfect weekend in berlin"
River Cruises,"Boat trips in Berlin on Spree river, on Landwehr canal or over the Wannsee",Upcoming,www.berlin.de,https://www.berlin.de/en/events/party/,See Official Site,"Berlin, Germany","boat trips in berlin on spree river, on landwehr canal or over the wannsee"
Berlin's Districts,"Information on residential areas, infrastructure, events, local authorities and leisure activities",Upcoming,www.berlin.de,https://www.berlin.de/en/events/party/,See Official Site,"Berlin, Germany","information on residential areas, infrastructure, events, local authorities and leisure activities"
Travel Information,"Train StationsPublic TransportAirport BERBerlin A-ZScooters, Bicycle & Car SharingWiFi in Berlin",Upcoming,www.berlin.de,https://www.berlin.de/en/events/party/,See Official Site,"Berlin, Germany","train stationspublic transportairport berberlin a-zscooters, bicycle & car sharingwifi in berlin"
Weitere Informationen zu diesem Auftritt,Experience 'Weitere Informationen zu diesem Auftritt' live in Berlin's diverse cultural scene.,Upcoming,www.berlin.de,https://www.berlin.de/en/events/party/,See Official Site,"Berlin, Germany",experience 'weitere informationen zu diesem auftritt' live in berlin's diverse cultural scene.
Official Website of Berlin,Berlin.de is a service of the State of Berlin.,Upcoming,www.berlin.de,https://www.berlin.de/en/events/party/,See Official Site,"Berlin, Germany",berlin.de is a service of the state of berlin.
Politics & Business,Berlin.de is a service of the State of Berlin.,Upcoming,www.berlin.de,https://www.berlin.de/en/events/party/,See Official Site,"Berlin, Germany",berlin.de is a service of the state of berlin.
New in Berlin,Berlin.de is a service of the State of Berlin.,Upcoming,www.berlin.de,https://www.berlin.de/en/events/party/,See Official Site,"Berlin, Germany",berlin.de is a service of the state of berlin.
What to see & do,Berlin.de is a service of the State of Berlin.,Upcoming,www.berlin.de,https://www.berlin.de/en/events/party/,See Official Site,"Berlin, Germany",berlin.de is a service of the state of berlin.
"Berlin kostenlos erleben - täglich neue Events, Veranstaltungen, Tips!",Home>Heute gratis in Berlin>Open Air Kino Kranzler Eck - Freilufkino am Kudamm (täglich),Upcoming,www.gratis-in-berlin.de,https://www.gratis-in-berlin.de/heute,Free / Kostenlos,"Berlin, Germany",home>heute gratis in berlin>open air kino kranzler eck - freilufkino am kudamm (täglich)
DJ-Set – Deutsches Theater,Experience 'DJ-Set – Deutsches Theater' live in Berlin's diverse cultural scene.,Upcoming,www.gratis-in-berlin.de,https://www.gratis-in-berlin.de/heute,Free / Kostenlos,"Berlin, Germany",experience 'dj-set – deutsches theater' live in berlin's diverse cultural scene.
Es-Dur Sonate vom Joseph Haydn am Mittag,Experience 'Es-Dur Sonate vom Joseph Haydn am Mittag' live in Berlin's diverse cultural scene.,Upcoming,www.gratis-in-berlin.de,https://www.gratis-in-berlin.de/heute,Free / Kostenlos,"Berlin, Germany",experience 'es-dur sonate vom joseph haydn am mittag' live in berlin's diverse cultural scene.
Lesung: Gute Solar-Laune,Experience 'Lesung: Gute Solar-Laune' live in Berlin's diverse cultural scene.,Upcoming,www.gratis-in-berlin.de,https://www.gratis-in-berlin.de/heute,Free / Kostenlos,"Berlin, Germany",experience 'lesung: gute solar-laune' live in berlin's diverse cultural scene.
"""Gewaltschutz bleibt politisch"" - Info-Veranstaltung im RegenbogenKino","Experience '""Gewaltschutz bleibt politisch"" - Info-Veranstaltung im RegenbogenKino' live in Berlin's diverse cultural scene.",Upcoming,www.gratis-in-berlin.de,https://www.gratis-in-berlin.de/heute,Free / Kostenlos,"Berlin, Germany","experience '""gewaltschutz bleibt politisch"" - info-veranstaltung im regenbogenkino' live in berlin's diverse cultural scene."
Cesy Leonhard: Machen macht Mut,Experience 'Cesy Leonhard: Machen macht Mut' live in Berlin's diverse cultural scene.,Upcoming,www.gratis-in-berlin.de,https://www.gratis-in-berlin.de/heute,Free / Kostenlos,"Berlin, Germany",experience 'cesy leonhard: machen macht mut' live in berlin's diverse cultural scene.
Lesung & Gespräch: Caspar Maria Russo liest aus »Prinzip Ungefähr«,Experience 'Lesung & Gespräch: Caspar Maria Russo liest aus »Prinzip Ungefähr«' live in Berlin's diverse cultural scene.,Upcoming,www.gratis-in-berlin.de,https://www.gratis-in-berlin.de/heute,Free / Kostenlos,"Berlin, Germany",experience 'lesung & gespräch: caspar maria russo liest aus »prinzip ungefähr«' live in berlin's diverse cultural scene.
Financial Wellness statt Finanzstress Finanzentscheidungen mit System (DIN 77230),Experience 'Financial Wellness statt Finanzstress Finanzentscheidungen mit System (DIN 77230)' live in Berlin's diverse cultural scene.,Upcoming,www.gratis-in-berlin.de,https://www.gratis-in-berlin.de/heute,Free / Kostenlos,"Berlin, Germany",experience 'financial wellness statt finanzstress finanzentscheidungen mit system (din 77230)' live in berlin's diverse cultural scene.
Podiumsdiskussion – Deutsches Theater,Experience 'Podiumsdiskussion – Deutsches Theater' live in Berlin's diverse cultural scene.,Upcoming,www.gratis-in-berlin.de,https://www.gratis-in-berlin.de/heute,Free / Kostenlos,"Berlin, Germany",experience 'podiumsdiskussion – deutsches theater' live in berlin's diverse cultural scene.
Infoveranstaltung DUO Mentoring für Azubis,Experience 'Infoveranstaltung DUO Mentoring für Azubis' live in Berlin's diverse cultural scene.,Upcoming,www.gratis-in-berlin.de,https://www.gratis-in-berlin.de/heute,Free / Kostenlos,"Berlin, Germany",experience 'infoveranstaltung duo mentoring für azubis' live in berlin's diverse cultural scene.
Ornament und Bedeutung – Mandala-Malkurs mit Shahla Aghapour,Experience 'Ornament und Bedeutung – Mandala-Malkurs mit Shahla Aghapour' live in Berlin's diverse cultural scene.,Upcoming,www.gratis-in-berlin.de,https://www.gratis-in-berlin.de/heute,Free / Kostenlos,"Berlin, Germany",experience 'ornament und bedeutung – mandala-malkurs mit shahla aghapour' live in berlin's diverse cultural scene.
Grüner Arbeitsmarkt im Wandel - welche Kompetenzen braucht die Zukufnt?,Experience 'Grüner Arbeitsmarkt im Wandel - welche Kompetenzen braucht die Zukufnt?' live in Berlin's diverse cultural scene.,Upcoming,www.gratis-in-berlin.de,https://www.gratis-in-berlin.de/heute,Free / Kostenlos,"Berlin, Germany",experience 'grüner arbeitsmarkt im wandel - welche kompetenzen braucht die zukufnt?' live in berlin's diverse cultural scene.
Vorgemerkt.,Experience 'Vorgemerkt.' live in Berlin's diverse cultural scene.,Upcoming,www.gratis-in-berlin.de,https://www.gratis-in-berlin.de/heute,Free / Kostenlos,"Berlin, Germany",experience 'vorgemerkt.' live in berlin's diverse cultural scene.
Kirchenführung mit Olaf Albrecht,Experience 'Kirchenführung mit Olaf Albrecht' live in Berlin's diverse cultural scene.,Upcoming,www.gratis-in-berlin.de,https://www.gratis-in-berlin.de/heute,Free / Kostenlos,"Berlin, Germany",experience 'kirchenführung mit olaf albrecht' live in berlin's diverse cultural scene.
Massage - Free full body Massage,Experience 'Massage - Free full body Massage' live in Berlin's diverse cultural scene.,Upcoming,www.gratis-in-berlin.de,https://www.gratis-in-berlin.de/heute,Free / Kostenlos,"Berlin, Germany",experience 'massage - free full body massage' live in berlin's diverse cultural scene.
Pokopia Pokémon Garten (real & rund um die Uhr),Experience 'Pokopia Pokémon Garten (real & rund um die Uhr)' live in Berlin's diverse cultural scene.,Upcoming,www.gratis-in-berlin.de,https://www.gratis-in-berlin.de/heute,Free / Kostenlos,"Berlin, Germany",experience 'pokopia pokémon garten (real & rund um die uhr)' live in berlin's diverse cultural scene.
"So, what have we got here? Harf Zimmermann Photographs From Four Decades (Do - Sa)","Experience 'So, what have we got here? Harf Zimmermann Photographs From Four Decades (Do - Sa)' live in Berlin's diverse cultural scene.",Upcoming,www.gratis-in-berlin.de,https://www.gratis-in-berlin.de/heute,Free / Kostenlos,"Berlin, Germany","experience 'so, what have we got here? harf zimmermann photographs from four decades (do - sa)' live in berlin's diverse cultural scene."
"Einführungskurs: ""Prompting in KI""",Heute  bis Mittwoch 01.07.2026,01.07.2026,www.gratis-in-berlin.de,https://www.gratis-in-berlin.de/heute,Free / Kostenlos,"Berlin, Germany",heute  bis mittwoch 01.07.2026
Contemporary Berlin 2026,Heute  bis Freitag 03.07.2026,03.07.2026,www.gratis-in-berlin.de,https://www.gratis-in-berlin.de/heute,Free / Kostenlos,"Berlin, Germany",heute  bis freitag 03.07.2026
Erzählcafé - Kiezgeschichte(n) live im Kiez in der Ingeborg-Bachmann-Bibliothek,Heute  bis Freitag 03.07.2026,03.07.2026,www.gratis-in-berlin.de,https://www.gratis-in-berlin.de/heute,Free / Kostenlos,"Berlin, Germany",heute  bis freitag 03.07.2026
"H2O - Kein Element, aber verbindend",Heute  bis Freitag 03.07.2026,03.07.2026,www.gratis-in-berlin.de,https://www.gratis-in-berlin.de/heute,Free / Kostenlos,"Berlin, Germany",heute  bis freitag 03.07.2026
Ausstellung | Francesca Martí: PASSAGE im HAUNT Berlin,Heute  bis Samstag 04.07.2026,04.07.2026,www.gratis-in-berlin.de,https://www.gratis-in-berlin.de/heute,Free / Kostenlos,"Berlin, Germany",heute  bis samstag 04.07.2026
"Tanz mit! – Kostenloses Tanzfestival am Potsdamer Platz (26. Juni – 11. Juli, tägl.)",Heute  bis Samstag 11.07.2026,26. Juni,www.gratis-in-berlin.de,https://www.gratis-in-berlin.de/heute,Free / Kostenlos,"Berlin, Germany",heute  bis samstag 11.07.2026
Oneironautentraining (Klartraumtraining),Heute  bis Mittwoch 15.07.2026,15.07.2026,www.gratis-in-berlin.de,https://www.gratis-in-berlin.de/heute,Free / Kostenlos,"Berlin, Germany",heute  bis mittwoch 15.07.2026
100 Jahre Christa Düll und Horst Heinen (Mo-Sa),Heute  bis Samstag 18.07.2026,18.07.2026,www.gratis-in-berlin.de,https://www.gratis-in-berlin.de/heute,Free / Kostenlos,"Berlin, Germany",heute  bis samstag 18.07.2026
Trace (Mo-Sa 12-20 Uhr),Heute  bis Samstag 18.07.2026,18.07.2026,www.gratis-in-berlin.de,https://www.gratis-in-berlin.de/heute,Free / Kostenlos,"Berlin, Germany",heute  bis samstag 18.07.2026
WM 2026 Fanmeile PublicViewing? Andere gute Locations,Heute  bis Sonntag 19.07.2026,19.07.2026,www.gratis-in-berlin.de,https://www.gratis-in-berlin.de/heute,Free / Kostenlos,"Berlin, Germany",heute  bis sonntag 19.07.2026
WM Public Viewing im ART Stalker Berlin Charlottenburg,Heute  bis Sonntag 19.07.2026,19.07.2026,www.gratis-in-berlin.de,https://www.gratis-in-berlin.de/heute,Free / Kostenlos,"Berlin, Germany",heute  bis sonntag 19.07.2026
Fußball-Sommer im Center am Potsdamer Platz,Heute  bis Sonntag 19.07.2026,19.07.2026,www.gratis-in-berlin.de,https://www.gratis-in-berlin.de/heute,Free / Kostenlos,"Berlin, Germany",heute  bis sonntag 19.07.2026
Meilenstein Strassenfest Event (täglich),Heute  bis Montag 20.07.2026,20.07.2026,www.gratis-in-berlin.de,https://www.gratis-in-berlin.de/heute,Free / Kostenlos,"Berlin, Germany",heute  bis montag 20.07.2026
Ausstellung im Frauentreffpunkt Ratswaag,Heute  bis Sonntag 26.07.2026,26.07.2026,www.gratis-in-berlin.de,https://www.gratis-in-berlin.de/heute,Free / Kostenlos,"Berlin, Germany",heute  bis sonntag 26.07.2026
Kunst- und Kreativmarkt (Arts & Crafts Market) | Creative Summer Potsdamer Platz,Heute  bis Samstag 01.08.2026,01.08.2026,www.gratis-in-berlin.de,https://www.gratis-in-berlin.de/heute,Free / Kostenlos,"Berlin, Germany",heute  bis samstag 01.08.2026
ABITARE - ein immersives Projekt von Samanta Malavasi,Heute  bis Samstag 01.08.2026,01.08.2026,www.gratis-in-berlin.de,https://www.gratis-in-berlin.de/heute,Free / Kostenlos,"Berlin, Germany",heute  bis samstag 01.08.2026
"Elementar - Hand, Klang, Natur",Heute  bis Samstag 01.08.2026,01.08.2026,www.gratis-in-berlin.de,https://www.gratis-in-berlin.de/heute,Free / Kostenlos,"Berlin, Germany",heute  bis samstag 01.08.2026
Dora Budor & Noah Barker (DI-FR),Heute  bis Sonntag 02.08.2026,02.08.2026,www.gratis-in-berlin.de,https://www.gratis-in-berlin.de/heute,Free / Kostenlos,"Berlin, Germany",heute  bis sonntag 02.08.2026
Berlin plant. Stunde Null (DI-SO),Heute  bis Sonntag 02.08.2026,02.08.2026,www.gratis-in-berlin.de,https://www.gratis-in-berlin.de/heute,Free / Kostenlos,"Berlin, Germany",heute  bis sonntag 02.08.2026
"Wohnzimmer - Ausstellung, Installation, Workshop (Mi - Mo)",Heute  bis Montag 03.08.2026,03.08.2026,www.gratis-in-berlin.de,https://www.gratis-in-berlin.de/heute,Free / Kostenlos,"Berlin, Germany",heute  bis montag 03.08.2026
Systemrelevant: Frauen in Herrscherfamilien (Mi - Mo),Heute  bis Montag 03.08.2026,03.08.2026,www.gratis-in-berlin.de,https://www.gratis-in-berlin.de/heute,Free / Kostenlos,"Berlin, Germany",heute  bis montag 03.08.2026
Ausstellung “Unlock the Future - Bildungsgerechtigkeit: Schlüssel zur Zukunft“,Heute  bis Samstag 08.08.2026,08.08.2026,www.gratis-in-berlin.de,https://www.gratis-in-berlin.de/heute,Free / Kostenlos,"Berlin, Germany",heute  bis samstag 08.08.2026
"Fotoausstellung: „Shadows, Motion“",Heute  bis Sonntag 30.08.2026,30.08.2026,www.gratis-in-berlin.de,https://www.gratis-in-berlin.de/heute,Free / Kostenlos,"Berlin, Germany",heute  bis sonntag 30.08.2026
Kolonnaden Bar auf Museumsinsel mit Musik (Mi - So),Heute  bis Montag 31.08.2026,31.08.2026,www.gratis-in-berlin.de,https://www.gratis-in-berlin.de/heute,Free / Kostenlos,"Berlin, Germany",heute  bis montag 31.08.2026
Nora Turato (Rund um die Uhr geöffnet),Heute  bis Montag 31.08.2026,31.08.2026,www.gratis-in-berlin.de,https://www.gratis-in-berlin.de/heute,Free / Kostenlos,"Berlin, Germany",heute  bis montag 31.08.2026
Ausstellung: Das verbindende Element - artspring berlin,Heute  bis Dienstag 01.09.2026,01.09.2026,www.gratis-in-berlin.de,https://www.gratis-in-berlin.de/heute,Free / Kostenlos,"Berlin, Germany",heute  bis dienstag 01.09.2026
Hélène Fauriat | Von der Résistance zur Zwangsarbeit in Schönefeld,Heute  bis Sonntag 06.09.2026,06.09.2026,www.gratis-in-berlin.de,https://www.gratis-in-berlin.de/heute,Free / Kostenlos,"Berlin, Germany",heute  bis sonntag 06.09.2026
Generationenübergreifende Tanzworkshops in Lichtenrade,Heute  bis Sonntag 27.09.2026,27.09.2026,www.gratis-in-berlin.de,https://www.gratis-in-berlin.de/heute,Free / Kostenlos,"Berlin, Germany",heute  bis sonntag 27.09.2026
Ausstellung: Deutungsräume - Vielschichtige Bildwelten (Mo. - Fr.),Heute  bis Freitag 09.10.2026,09.10.2026,www.gratis-in-berlin.de,https://www.gratis-in-berlin.de/heute,Free / Kostenlos,"Berlin, Germany",heute  bis freitag 09.10.2026
Nebelskulptur in Neuer Nationalgalerie- auch von oben,Heute  bis Sonntag 25.10.2026,25.10.2026,www.gratis-in-berlin.de,https://www.gratis-in-berlin.de/heute,Free / Kostenlos,"Berlin, Germany",heute  bis sonntag 25.10.2026
Forced to Work | Willing to Survive,Heute  bis Sonntag 25.10.2026,25.10.2026,www.gratis-in-berlin.de,https://www.gratis-in-berlin.de/heute,Free / Kostenlos,"Berlin, Germany",heute  bis sonntag 25.10.2026
Ostgebiete / Ziemie Zachodnie. Eine deutsch-polnische Spurensuche,Heute  bis Sonntag 17.01.2027,17.01.2027,www.gratis-in-berlin.de,https://www.gratis-in-berlin.de/heute,Free / Kostenlos,"Berlin, Germany",heute  bis sonntag 17.01.2027
Skater & Rollbrettfahrer vor und nach dem Mauerfall,Heute  bis Sonntag 04.04.2027,04.04.2027,www.gratis-in-berlin.de,https://www.gratis-in-berlin.de/heute,Free / Kostenlos,"Berlin, Germany",heute  bis sonntag 04.04.2027
Leseabend von textcollective,Jeden 4.			Dienstag,Upcoming,www.gratis-in-berlin.de,https://www.gratis-in-berlin.de/heute,Free / Kostenlos,"Berlin, Germany",jeden 4.			dienstag
Diskussions- und Literaturcafé,Jeden 3.			Dienstag,Upcoming,www.gratis-in-berlin.de,https://www.gratis-in-berlin.de/heute,Free / Kostenlos,"Berlin, Germany",jeden 3.			dienstag
